{"schema_version":"region_talk_external_research.v1","run":{"request_id":"region-talk-external-2026-07-31-174033","executed_at":"2026-07-31T17:40:33Z","window_start":"2025-01-01","window_end":"2026-07-31","research_languages":["ru","en"],"product_language_policy":"ru_or_mostly_ru","scope_note":"Второй ограниченный качественный веб-поиск новых внешних содержательных публикаций о Калининградской области. Результат отражает проверенный дополнительный пул, а не полное число или частоту публикаций в интернете; максимальная готовность — candidate_report."},"coverage":[{"contour":"natural_science","queries":["2025 2026 Калининградская область Балтийское море макроводоросли исследование журнал DOI","2025 2026 Куршский залив флора исследование статья DOI","2025 Kaliningrad Oblast Curonian Spit Baltic Sea ecology study"],"domains_opened":["jor.ocean.ru","field-journal.ru","sciencedirect.com","journals.rudn.ru","vestnik.mauniver.ru"],"verified_candidate_count":2,"notes":"skipped_seen=2. Проверены русские и английские формулировки, DOI-цепочки и полные тексты; один широкий балтийский обзор исключен из-за вторичной роли Калининграда, а новые чистые русскоязычные работы после связанных ссылок исчерпались."},{"contour":"social_science","queries":["2025 2026 Калининградская область культурное наследие экскурсии исследование журнал","2025 2026 Куршская коса устойчивый туризм управление исследование","2025 Калининградская область миграция региональная идентичность исследование"],"domains_opened":["ecoregion.ru","cyberleninka.ru","ufajournal.ranepa.ru","qje.su","peasantstudies.ru"],"verified_candidate_count":1,"notes":"skipped_seen=1. Один прикладной кейс сохранен для ручной проверки; одна перспективная статья осталась unresolved из-за недоступности первичной страницы, а один описательный текст исключен как методологически слабый."},{"contour":"architecture_urbanism","queries":["2025 2026 Калининград архитектура интерьер проект федеральное издание критика","2026 Kaliningrad architecture criticism design project","site:salon.ru Калининград 2025 интерьер"],"domains_opened":["salon.ru","archi.ru","interior.ru","prorus.ru"],"verified_candidate_count":1,"notes":"skipped_seen=2. Принят один новый редакционный разбор; две страницы профессионального издания оставлены unresolved из-за технической недоступности, а уже учтенные материалы были пропущены до повторной проверки."},{"contour":"project_catalog","queries":["site:design-mate.ru/read/objects Калининград 2025","site:interior.ru Калининград 2025 проект","2025 Калининград интерьер проект профессиональное издание"],"domains_opened":["design-mate.ru","interior.ru","prorus.ru","architime.ru"],"verified_candidate_count":3,"notes":"skipped_seen=3. Три подробных и самостоятельных проектных разбора прошли порог; фирменные карточки, реклама и уже учтенные страницы не использовались для заполнения квоты."},{"contour":"history_memory","queries":["2025 2026 Кёнигсберг Калининград история археология федеральное издание","2026 Калининград раскопки Форштадт Институт археологии РАН","2025 Калининград наследие Кёнигсберг исторический очерк журнал"],"domains_opened":["archaeolog.ru","mir24.tv","nn.media","ufajournal.ranepa.ru"],"verified_candidate_count":1,"notes":"skipped_seen=2. Первичный отчет Института археологии прошел как долговечный исторический материал; один очерк остался unresolved, а остальные результаты были повторами, новостями или имели недостаточную связь с современным регионом."},{"contour":"film_criticism","queries":["фестиваль Короче 2025 критика фильмы","Калининград Короче 2025 рецензия","2025 Короче фестиваль кинокритики Калининград"],"domains_opened":["seance.ru","kinoart.ru","daily.afisha.ru","kinopoisk.ru"],"verified_candidate_count":2,"notes":"skipped_seen=2. Два новых самостоятельных критических материала приняты; новостные итоги, анонсы и уже учтенные обзоры не проходили повторную верификацию."},{"contour":"culture_feature","queries":["2025 Калининград культура музей музыка федеральный журнал","site:nn.media/magazine/3-133 Калининград","2025 Калининград культурный проект интервью журнал"],"domains_opened":["nn.media","theartnewspaper.ru","knife.media"],"verified_candidate_count":2,"notes":"skipped_seen=5. Два материала тематического культурного выпуска сохранены для ручной проверки; один сильный по форме текст исключен после проверки центральности, а повторы и краткие новости пропущены."},{"contour":"intellectual_media","queries":["site:gorky.media Калининград 2025 OR 2026 эссе интервью","site:arzamas.academy Калининград 2025 OR 2026","site:postnauka.ru Калининград 2025 OR 2026","site:knife.media Калининград 2025 OR 2026"],"domains_opened":["gorky.media","arzamas.academy","postnauka.ru","knife.media"],"verified_candidate_count":0,"notes":"skipped_seen=1. Контур пройден несколькими платформами и формулировками; новый содержательный материал «Ножа» исключен, поскольку Калининград оказался преимущественно местом проведения выставки, а не предметом анализа."},{"contour":"editorial_travel","queries":["2025 2026 Калининград путеводитель авторский журнал путешествия без тура","2025 Калининград неочевидные места федеральное медиа","2026 Калининград гид редакционный путешествия"],"domains_opened":["style.rbc.ru","t-j.ru","vokrugsveta.ru","profile.ru","kbp-travel.ru"],"verified_candidate_count":2,"notes":"skipped_seen=3. Два оригинальных редакционных гида прошли порог; коммерческие туры, SEO-страницы и ранее учтенные публикации не открывались для детальной повторной проверки."}],"candidates":[{"canonical_url":"https://t-j.ru/list/kaliningrad-places/","doi":null,"publication":{"title":"Куда сходить в Калининграде: 15 неочевидных мест","authors":["Лейла Разина"],"source_name":"Т—Ж","source_domain":"t-j.ru","published_at":"2026-07-21","modified_at":null,"date_precision":"day","date_basis":"page_metadata","language":"ru","content_type":"editorial_guide","access_status":"full_text"},"source_assessment":{"entity_type":"media_brand","scope":"external","externality_basis":"Т—Ж — федеральное медиа о жизни, деньгах и путешествиях с материалами по всей России; авторская локальная экспертиза не делает сам источник региональным.","externality_evidence_refs":["c10.source"]},"region_relevance":{"centrality":"central","topics":["неочевидные места","городская история","Балтийская коса","Бальга","местные маршруты"],"summary":"Материал полностью посвящен пятнадцати менее очевидным местам Калининграда и области, выбранным автором, которая выросла в регионе, и снабжен подробными историческими и практическими пояснениями.","evidence_refs":["c10.primary"]},"policy_classification":{"newsiness":"non_news","commerciality":"independent","research_match":true,"product_policy_match":true,"language_policy_match":true,"hard_exclusion_codes":[],"boundary_flags":["time_sensitive_access_details"]},"quality_assessment":{"track":"popular_editorial","source_authority":{"score":4,"reason":"Тип и внешний охват источника подтверждены редакционной или институциональной страницей.","evidence_refs":["c10.source"]},"evidence_depth":{"score":4,"reason":"Первичная страница содержит достаточно подробностей для проверки основных тезисов и структуры материала.","evidence_refs":["c10.primary"]},"editorial_independence":{"score":4,"reason":"На проверенной странице не обнаружена явная рекламная маркировка; независимость оценена по доступным данным.","evidence_refs":["c10.primary"]},"originality":{"score":4,"reason":"Материал содержит самостоятельный редакционный разбор, интервью, критику либо подробное описание проекта.","evidence_refs":["c10.primary"]},"kaliningrad_centrality":{"score":4,"reason":"Калининградский сюжет является центральным или существенным предметом публикации.","evidence_refs":["c10.primary"]},"public_interest":{"score":4,"reason":"Сюжет дает понятный вывод для читателя за пределами узкого профессионального круга.","evidence_refs":["c10.primary"]},"accessibility":{"score":4,"reason":"Основной текст доступен онлайн и изложен без непреодолимого терминологического барьера.","evidence_refs":["c10.primary"]},"quality_tier":"strong","scholarly_details":null,"editorial_details":{"byline_present":true,"original_reporting_or_analysis":true,"sources_or_method_visible":true}},"editorial_pack":{"title_short":"15 неочевидных мест Калининграда и области","teaser":"Лейла Разина собирает места, куда ходят сами калининградцы: от Юдиттен-кирхи и Закхаймских ворот до Бальги, Риндерорта и Балтийской косы.","source_overview":"Т—Ж — внешнее федеральное медиа о жизни и путешествиях с авторскими материалами по разным регионам России.","reader_takeaway":"Подборка расширяет привычный туристический маршрут и объясняет исторический или личный смысл каждой точки.","why_selected":"Выбран за оригинальный местный взгляд внутри внешнего издания, подробность и отсутствие продажи тура.","caveat":"Режим доступа, состояние объектов и практические детали нужно сверять на дату поездки, особенно для удаленных и руинированных мест.","copy_support":[{"surface":"teaser","sentence_index":0,"evidence_refs":["c10.primary"]},{"surface":"source_overview","sentence_index":0,"evidence_refs":["c10.source"]},{"surface":"reader_takeaway","sentence_index":0,"evidence_refs":["c10.primary"]},{"surface":"why_selected","sentence_index":0,"evidence_refs":["c10.primary","c10.source"]},{"surface":"caveat","sentence_index":0,"evidence_refs":["c10.primary"]}]},"media_and_rights":{"media_gate_status":"not_evaluated","rights_policy":"link_only","license":null,"media_reuse_allowed":false,"candidate_urls":[],"evidence_refs":[]},"evidence":[{"evidence_id":"c10.primary","supports":["publication","region_relevance","editorial_pack","quality","caveat"],"url":"https://t-j.ru/list/kaliningrad-places/","page_role":"primary_article","retrieved_at":"2026-07-31T17:40:33Z","location_hint":"Дата, авторская подпись, вводная и пятнадцать разделов","paraphrase":"Лейла Разина, выросшая в Калининграде, 21 июля 2026 года публикует подробный список пятнадцати неочевидных мест города и области с картой